{
  "schema_version": "7.0",
  "run_id": "edfda696-f842-4879-9eeb-67c7d825fb03",
  "agent_name": "example",
  "status": "succeeded",
  "confidence": 0.5,
  "reasoning_summary": "example",
  "warnings": [
    "example"
  ],
  "requires_human_review": true,
  "completed_at": "2026-07-31T12:00:00Z",
  "plan_id": "1b988182-c6a4-4d9b-a31f-bc69a0124f8c",
  "primary_path": [
    {
      "step_id": "example",
      "knowledge_node_id": "example",
      "sequence_no": 1,
      "difficulty_level": 1,
      "resource_types": [
        "explanation"
      ],
      "success_criteria": [
        "example"
      ],
      "prerequisite_node_ids": [
        "example"
      ]
    }
  ],
  "alternative_paths": [
    [
      {
        "step_id": "example",
        "knowledge_node_id": "example",
        "sequence_no": 1,
        "difficulty_level": 1,
        "resource_types": [
          "explanation"
        ],
        "success_criteria": [
          "example"
        ],
        "prerequisite_node_ids": [
          "example"
        ]
      }
    ]
  ],
  "path_risks": [
    "example"
  ],
  "evidence": [
    {
      "evidence_id": "7ef52da9-2b45-4f78-a56f-016507e68b8d",
      "knowledge_node_id": "example"
    }
  ]
}
